"Write 5 sentences","Write five sentences. They can be as long or as short as you like, but try to make them more than simple descriptive sentences."
"Translate something from social media","Go on Facebook or Tumblr and find a medium-sized post. Translate it into English and post the translation with a link to the original."
"Have a conversation with a friend on Whatsapp","Send a short message or few messages to a friend via Whatsapp / Signal or whatever you use. Tell them what you're up to. Perhaps ask a question or two. Spend the full 10 minutes chatting."
"Record a video of yourself speaking your language","Pick a topic, perhaps from this list (iteslj.org/questions/), and record yourself talking about that topic for 10 minutes. Try to keep speaking, regardless of whether you stumble or forget a word. BONUS: Watch the video back and make a note of things you notice you want to improve or look up as a result."
"Describe the room in which you're sitting","Talk out loud - to yourself, or whoever you're sitting with - and describe all the different objects, colours and features of the room or location in which you're sitting. If you don't know a specific word, try to describe it in another roundabout way that doesn't require you to lapse into your mother-tongue language. Keep going, even if you stumble or forget a word. BONUS: Make a note of any words you'd like to look up in a dictionary."
"Correct a post on Lang-8","Lang-8 is a site where you can get corrections on things you write. It works on an honour-basis, where others correct your sentences and you correct the things they write (in your own mother-tongue language). Take 10 minutes to correct a longer post written on lang-8. This task gives you a karma point. Correct someone else's entry now and you'll get more corrections of your own."
"Teach a grammatical feature","Find a friend (or willing accomplice) and teach them a grammatical feature of the language you're learning. Make sure it's small enough that you can potentially explain it within 10 minutes."
"Write a message to a teacher","If you've been studying for a year or two, you've probably worked with at least one teacher. Send them an email or message in the language you're studying. Let them know what you're up to and what kinds of things you're studying at the moment. Tell them something you appreciate that they taught you."
"Skim the top headlines on a news website","Open up a news site that uses the language you're studying. Skim the top headlines and figure out what's happening in the world. BONUS: Tell a friend what you learned from your 10 minutes of news browsing."
"Reply to someone on social media","Find a tweet, Instagram or Facebook post written in the language you're studying. Read it and reply back in the language you're studying."
"Watch a song on YouTube","Find a song in your target language, listen to the lyrics as you watch. Perhaps turn on the subtitles if the words are hard to distinguish. Try to figure out what the song is about. BONUS: Look up the lyrics afterwards and take a shot at reading them more closely."
"Listen to a poem being recited","Find a poem being recited in your target language. YouTube is probably the best place to find these. Try to understand the gist of the poem. Bear in mind that poetry is much harder to understand than prose, so don't worry if you find this hard."
"Brainstorm connect words","Think of a starter word or topic (anything will do). Write that word or topic in the centre of a blank piece of paper. Then write related / connected words on the rest of the paper. Connect them together with lines like on a mindmap. Use only your target language."
"Get some vocabulary context","Think of a random word or connector particle or verb in your target language. Do a search for that word in Google News and Context Reverso (if your language is supported). Read the sentences that show up, making a note of the particular contexts in which that word or phrase is used."
"Do a grammar drill","Pick a verb. See how quickly you can recall / say all the conjugations out loud, in as many tenses as you are able. If your language has noun and adjective declensions as well, run through those."
"Read a random wikipedia page in your target language","Visit https://meta.wikimedia.org/wiki/List_of_Wikipedias, pick the wiki in your language of study, then on the left hand side find a ""random article"". Read the page for 10 minutes to understand the contents."
"Read any random text you have near you","Read for 10 minutes in any random text you have near you or on your computer / phone. BONUS: Highlight or mark any words you don't understand."
"Prepare 3 things you can say to a taxi driver next time you're taking a cab","Think of three topics that you can discuss with a taxi driver next time you have to take a journey with a taxi. Think of what words would come up in conversation about those three topics. Think what kinds of questions (s)he might ask in response."
"Study using Bliubliu","Bliubliu is a great site for getting some quick reading practice. (If you don't already have an account, take the 10 minutes to get set up). Pick a topic and let Bliubliu give you short texts. Click the words you know so it knows what level you're at."
"Write a short poem","Write a short poem. It can be about anything. Just get writing. Don't spend too much time thinking about this one. The point is to write and use your language."
"Study using Readlang","Readlang is a service that allows you to read longer texts, look up words and test yourself on the new words you learnt while reading. (If you don't already have an account, take the 10 minutes to get set up). Pick a text (either an article you found online, or use the service's own library to suggest a text)."
"Tell a story","Talk for 10 minutes without stopping. The challenge is to keep going, to keep making variations on what you're saying, to keep using connector words and phrases. Tell a story about something that happened to you, or maybe explain something that happened years ago. Keep talking."
"Shadow an audio-transcript recording","Find a site where you can listen to audio recordings alongside transcripts. (News sites are probably your best bet for finding these, and some even have special sections for learners of those languages). Shadow the audio out loud, simultaneously alongside the transcript. Try to keep up with the recording and mimic their intonation."
"Learn about a well-known figure","Research the biography of a well-known figure from the culture or history of the country/people who speak your target language. Use original-language materials. Get the outline of their life story. Start with local-language wikipedia."
"Zero out your Anki","If you don't know what Anki is, start here: https://alexvermeer.com/anki-essentials/. If you're using it already, take these 10 minutes to make progress zeroing out your Anki words for review today."
"Review your language-learning notebook","If you don't have a physical notebook, get one. Write down words you want to know in your target language, words you didn't understand while watching TV and so on. Review the things you've written down during the past week. Add any new words to Anki."
"Play a round or three of Pictionary / charades using your target language","This requires multiple speakers of your target language, but if you have a group around you, get someone to mime a topic, name of a film or book and try guessing what it is using only your target language. Time yourself."
"Write a paragraph of text (no repetition edition)","Write a paragraph of text without using the same word twice. This is very hard to do in practice, even using your mother-tongue. Try not to think too much, though, and keep writing."
"Write a paragraph of text (last-letter edition)","Write a paragraph of text in which the last letter of the previous word determines the first letter of the next word. This is harder than it sounds. Try not to think too much, though, and keep writing."
"Read something written over 100 years ago","Find something written in your target language that was written over 100 years ago. Notice how the language is different from the kinds of things you read online. Notice any similarities. Enjoy this mental time-travel experience!"
"Read something written over 1000 years ago","If your language is old enough, find something written in your target language that was written over 1000 years ago. Notice how the language is different from the kinds of things you read online. Notice any similarities. Enjoy this mental time-travel experience!"
"Talk to a fellow language learner","Find a friend studying the same language as you, someone at a similar competency level. Have a conversation with them."
"Take a photo and write a caption","Write a caption using your target language. Try to really flex your language muscles. Don't settle for a brief or purely descriptive caption. You have ten minutes here, so write about what the photo reminds you of, or what thoughts it provokes."
"Email a friend","Send an email to a friend who speaks your target language. Tell them what you're up to, what you've been studying, or anything else you'd like!"
"Write a summary of the news","Take 10 minutes to write down a summary of the important things going on in the news this week. Don't worry too much about the register or formality level of the language. Just try to communicate the important topics. Keep writing."
"Enquire about flight fares","Find the number of a random travel agent in the country that speaks the language you're learning. (TIP: Use something like Yelp to find a number). Call them up on your phone (or using Skype) and ask if it's possible to book a flight from where you live to another country (it doesn't matter which). Ask how much the tickets cost. Ask for the fare difference between first, business and economy class. Ask what the food options are. End by saying it's too expensive so you can't book, but thank them for their time. Hang up."
"Email a friend about your plans for the coming year","Send an email to a friend who speaks your target language. Tell them what you plan to do during the next 6-12 months. Tell them what you're excited about as well as what you're not looking forward to."
"Read a news article","Read through as much of a news article as is possible in 10 minutes. Either visit BBC News' local-language edition or another website published using your target language"
"Write a summary of an article you read recently","Begin by explaining the overall gist of the article, then get into the specifics of how the piece argued its message. Try to use some of the same vocabulary or phrases that were used in the original article. Don't think too much about this; keep writing. Keep communicating."
"Listen to part of a podcast episode","If you don't use a podcast player, maybe spend the 10 minutes setting this up. Once that's done, do a search online for ""[your language] podcasts"" and pick a few podcasts that interest you. Subscribe to them using your podcast player, and listen to 10 minutes of an episode. Your player will keep your place in the podcast for when you next listen, so don't worry if the 10 minutes finishes before the end of the episode."
"Summarise the last film you saw","Do this in writing or out loud. Describe the plot. Explain whether you liked the film or not. Explain why. BONUS: Record your summary/review and post it to YouTube. Or if you wrote it down, post it to Lang-8."
"Summarise the last book you read","Do this in writing or out loud. Describe the plot. Explain whether you liked the book or not. Explain why. BONUS: Record your summary/review and post it to YouTube. Or if you wrote it down, post it to Lang-8."
"Translate a text","Take 10 minutes to translate something you read recently. A partial translation is fine. Post your translation somewhere online with a link to the original source text when the 10 minutes are up. BONUS: Consider having a dedicated blog or tumblr where you can post your translations as you do them. This way you'll have a log of your study progress."
"Record a conversation with a friend","Talk about anything you'd like, but don't use anything other than your target language. Once the time is up, post the conversation online to Youtube or Soundcloud. BONUS: Consider doing this more regularly and you'll have your own podcast."
"Review your language-learning log","(If you haven't already set up a language-learning log, take the time to set that up.) Read over the past few weeks of your language-learning. Assess where more focus is needed. Think about what activities you could do to reach that goal. Write down your conclusions."
"Introduce the city where you live","Write a short passage introducing the city where you live to a visitor from the country where your target language is spoken. BONUS: Post this to lang-8, and/or record the passage and post that audio recording to Soundcloud."
"Do a short workout","Search on YouTube for a short workout video that uses your target language. Follow along and do the workout! Searching ‘yoga' or ‘7-minute workout' (translated into your language) is usually an easy way to find a video."
"Translate the lyrics to a favourite song","Search for the full lyrics of a song originally written in your target language. Translate the song's lyrics into English (or as much of it as is possible in 10 minutes). BONUS: Post these lyrics and the translation online."
"Recite a poem","Record yourself reciting a poem out loud. Post the recording to Soundcloud. Review your pronunciation, noting where you could improve."
"Write a news summary using formal language","Most languages have some kind of formal language used for media broadcasts. Try writing a summary of the day's news using this formal/elevated language."
"Practice some recently-learned words","Write some sentences using words that you learned only recently. Post these practice sentences to Lang-8 to make sure that you're using the words in the right way / context."
"Brainstorm a topic","Brainstorm two or three dozen words in English related to a random topic you pick. Don't take more than 2 or 3 minutes for this task. Then for the rest of the time, try to translate the words into your target language. Note which words you don't know, and after the time is up, look them up in a dictionary."
"Go for a short walk","Walk around the block or walk around the area where you're studying/based. As you walk, have an inner monologue in which you describe everything you see around you. Keep talking to yourself; don't use English. When you get back, make a note of the words you were unable to recall."
"Look up a recipe","Search for recipes using sites in your target language. Find one that you think would be tasty. Figure out what ingredients are needed. BONUS: Actually prepare / cook that recipe later in the day."
"Watch a news report","Search YouTube for a news report or short film about any topic that interests you. Make sure it is in your target language. Watch the video."
"Research a topic that interests you","Use only sources in your target language. Read a variety of sources. Start to figure out the outlines of that topic."
"Summarise something you learnt recently","Pick something you learnt or researched recently. Summarise the important points about that topic or issue. Summarise the main sources you used to come to these conclusions. BONUS: Post your summary to Lang-8 or your blog for feedback."
"Tell a friend about something you learnt recently","Pick something you learnt or researched recently. Summarise the important points about that topic or issue. Summarise the main sources you used to come to these conclusions. BONUS: Record it and post your conversation to YouTube or Soundcloud for feedback."
"Start a newsletter in your target language","Go to tinyletter.com and set up a free account. Invite some friends to subscribe. In the future when you have something to write, you can post it to your newsletter."
"Look at a frequency list","Frequency vocabulary lists are lists of words organised by the frequency which they are generally used. Search online for ""[your language] frequency vocabulary list"" and look to see if there are any of the most frequent words that you don't know. Make a note of the words that you struggle to understand."
"Take a test / participate in a poll","Go onto a media site published in the language you study. Most such sites have polls or quizzes on their home page. Read the question / poll and vote. Look at the results. Think about why the results came out the way they did."
"Think about conversation topics","Visit iteslj.org/questions/ and pick a topic. Look at the questions. Imagine you had to answer the questions in your target language. What vocabulary would you need to know to be able to answer those questions? Make a note of these missing words."
"Record a news report","Think of something that happened recently in the news. Record yourself describing the event as if you are a newscaster. Prepare for a few minutes beforehand and then record. BONUS: Post the recording to Soundcloud."
"Search for a job","Browse job-search sites using your target language. Search for careers or jobs that interest you. Read some of descriptions and requirements of the jobs on offer."
"Teach something","Think of something you know, but a friend doesn't know. Take ten minutes to teach that topic or skill to your friend, using only your target language."
"Teach something online","Think of something you know. Record a video to YouTube in which you teach that topic or skill, using only your target language. Don't think about this too much. Take a minute or two to sketch out a rough structure and then just get talking."
"Write 65 words","Write about what you did during the past 12 months."
"Write 65 words","Write about what you want to do during the coming 12 months."
"Write 65 words","Write about what you consider to be the qualities possessed by a good leader."
"Write 65 words","Describe earth and human society to a visiting alien."
"Write 65 words","Write a bullet point list of why you're studying your target language (using that target language)."
"Translate a Restaurant Menu","Search the web for online restaurant menus in Arabic. (If you can't find any, use the Arabic sub-site of https://ifood.jo/ for suggestions). Go through the menu and translate all the different foods. BONUS: Write down your translations of the menu into English, then close the website and try to translate the text back into Arabic."
"Take a dictation","Open up a video in Arabic on YouTube. Depending on your level / confidence, adjust the speed of the video to something comfortable enough so that you can take dictation. You have two options: 1) take notes that are detailed enough that you can explain the contents to someone else or 2) take a word-for-word dictation."
"Do some video description","Open up a video in Arabic on YouTube. Turn off the sound or mute your computer/phone. Start talking out loud, describing what is happening as images continue to change in the video. Imagine you are describing it to someone who can't see, or who isn't watching the video with you."
"Journal to yourself","Write a journal entry (on paper or digitally) to yourself about what you got done during the past 24 hours (what worked, what didn't)."
"Read Out Loud","Pick a text that you have to hand (or go online). Take the 10 minutes to read out loud from the text, using your best pronunciation and intonation."
DictionaryBot,"Find a passage of text that you've read recently, or that you find easy to read. Go through the text and, as you stop by each word, define the term using your target language. You probably won't get very far into the text by the time expires, but make sure not to use any English or anything that isn't your target language to explain the definitions of each word."
"Describing making a salad","Describe all the steps you need to carry out to make a salad. Don't skimp on the description. Instead of just 'add all the ingredients into a boil', think of all the sub-steps like how you decide what to make, what utensils you choose to prepare the various ingredients, how you make sure you have enough in the bowl and so on. BONUS: Record a video as you do this and post it online to YouTube."
"Describing making a cup of tea","Describe all the steps you need to carry out to make a cup of tea. Don't skimp on the description. Instead of just 'boil water', think of all the sub-steps like choosing how to boil the water, choosing a kettle / pot, pouring the water, making sure it doesn't overflow and so on. BONUS: Record a video as you do this and post it online to YouTube."
"List word opposites","Write a list of 20-30 random words that occur to you on a piece of paper. Then write their opposites alongside. Some words won't have opposites, but you can get creative. The opposite of 'elephant' could be a mouse or a worm or a fish or whatever you think!"
"Make a new city plan","Your city or the place where you live probably has some problems it needs fixing. Take this time to outline and then write a city plan (in your target language) that could be taken and used to fix the problems. Begin each paragraph by stating the specific problem you want to solve, and then end with the solution. BONUS: Post this on lang-8 (http://www.lang-8.com/) and get corrections!."
"Create a dialogue","Write a dialogue about any topic that comes to mind. Use the informal style of your language for this, even though it is written down. Write for as long as the timer is running. BONUS: Post the text of your dialogue online for others to use."
"Creating stories from pictures","Find a magazine or advertisement leaflet or some other such material. You could even go online to the website of IKEA (http://www.ikea.com). As you start looking through the pictures, start talking about the people and the things you see. Early on, start labelling the items, but then you should also eventually start imagining scenarios about the lives of the people in the pictures. Or if there is nobody in the picture, think about why they are absent. Say it all out loud."
"Practice with word substitutions","Use Clozemaster (https://www.clozemaster.com/) to practice your target language. You'll get a sentence and a translation and you'll have to choose what words fills in the blanks. Enjoy this game; it's compulsively addictive."
"Translate some sentences","Contribute to the Tatoeba Project by translating some sentences from your target language into your mother tongue. Visit https://tatoeba.org/eng/activities/translate_sentences to get started. Keep going until the time is up."
"Connect sentences","Visit Tatoeba (https://tatoeba.org/eng/activities/translate_sentences) to get a list of random sentences in your target language. Take a moment to make sure you understand all the sentences. Then think of sentences you could write to connect the random sentences together. Sometimes it will be small phrases that can make the connection. Other times you'll have to get creative and write longer sentences. BONUS: Put all the sentences together and submit to Lang8 (http://lang-8.com/) for corrections and feedback."
"Connect words","Write a list of a few words chosen at random. Take the rest of the time to make a story (say it out loud) that connects these words together. BONUS: Reuse the same words in different contexts and situations within the same story."
"Watch some cartoons!","Find some cartoons that use your target language. YouTube will have lots. This task is all about the fun. You've been working hard, so this is where you just get to enjoy watching cartoons for the entirety of the time period you chose. Well done!"
"Listen to the radio","Visit TuneIn online radio (http://tunein.com/) and search for a radio station in the country where your target language is spoken. Pick a random or a favourite station and listen to it for half the time allocated. Take notes while you're listening. Once you reach half-way, turn the radio off and try to write a summary. Alternatively, try saying it out loud (either just to yourself or to someone else)."
"When I was young...","This is an exercise to keep writing. Complete the sentence ""when I was young..."" however you feel appropriate. Whenever you get stuck, go back to the original prompt and try to think of something new/different that happened when you were young. BONUS: Read the text of what you wrote out loud after you've finished writing."
"National Anthem","Listen to the national anthem of the country where your language is spoken. Translate the text of the national anthem. BONUS: Learn the national anthem by heart and sing along with it."
"Random Animal Story","Visit https://www.randomlists.com/random-animals and look at the animal photos displayed on thes screen in front of you. For as long as the timer is running, make a story in which all of the animals are used. Make sure the different parts of your story connect together. BONUS: record the audio or video of your story and post it online for feedback."
"Weather descriptions","Look outside. Describe the weather (either in writing or out loud). Once you're finished, describe what the opposite of the current weather would be. Then describe your favourite kind of weather (and why). Then describe your least favourite kind of weather (and why)."
"Random Word Game","Visit https://randomword.com/ and read the word on the screen. Now, either in writing or out loud, try to define that word as if you are explaining it to someone who doesn't know what it is. Use only your target language. BONUS: Try this out on an actual friend; see if they are able to identify the random word."
